{
  "$schema": "https://raw.githubusercontent.com/JoaEinsson/Basis/main/schemas/basis-theme.schema.v1.json",
  "format": "basis-theme",
  "schema_version": 1,
  "id": "builtin:paper",
  "name": "Paper",
  "author": "Basis",
  "based_on": null,
  "appearance": "light",
  "min_app_version": "0.1.0",
  "capabilities": [],
  "tokens": {
    "color.background.canvas": "#f7f7f5",
    "color.background.surface": "#ffffff",
    "color.background.surfaceRaised": "#ffffff",
    "color.background.surfaceSunken": "#f0f1ef",
    "color.background.sidebar": "#ffffff",
    "color.background.player": "#ffffff",
    "color.background.overlay": "#ffffff",
    "color.background.input": "#ffffff",
    "color.background.titlebar": "#ffffff",
    "color.background.menu": "#ffffff",
    "color.background.tooltip": "#202124",
    "color.background.scrim": "#20212466",
    "color.interaction.hover": "#ededeb",
    "color.interaction.pressed": "#dfe4ff",
    "color.interaction.dragInsertion": "#4056b4",
    "color.windowControl.hover": "#ededeb",
    "color.windowControl.closeHover": "#c42b1c",
    "color.windowControl.closeForeground": "#ffffff",
    "color.text.primary": "#202124",
    "color.text.secondary": "#5f6368",
    "color.text.tertiary": "#74777d",
    "color.text.disabled": "#8b8e93",
    "color.text.inverse": "#ffffff",
    "color.icon.primary": "#202124",
    "color.icon.secondary": "#5f6368",
    "color.icon.disabled": "#8b8e93",
    "color.accent.primary": "#4056b4",
    "color.accent.hover": "#31479f",
    "color.accent.active": "#273a8c",
    "color.accent.muted": "#dfe4ff",
    "color.accent.onAccent": "#ffffff",
    "color.selection.background": "#dfe4ff",
    "color.selection.foreground": "#202124",
    "color.border.default": "#d8d9dc",
    "color.border.subtle": "#e7e8ea",
    "color.border.strong": "#b3b6bc",
    "color.border.menu": "#c9cbd0",
    "color.divider": "#d8d9dc",
    "color.focus.ring": "#4056b4",
    "color.status.success": "#237a46",
    "color.status.onSuccess": "#ffffff",
    "color.status.warning": "#8a5b00",
    "color.status.onWarning": "#ffffff",
    "color.status.error": "#b3261e",
    "color.status.onError": "#ffffff",
    "color.status.info": "#286ca8",
    "color.status.onInfo": "#ffffff",
    "color.favorite": "#a73562",
    "color.player.progress": "#4056b4",
    "color.player.progressTrack": "#c5c7cc",
    "color.player.buffered": "#8b8e93",
    "color.waveform.active": "#4056b4",
    "color.waveform.inactive": "#8b8e93",
    "color.artwork.fallbackStart": "#e1e3e9",
    "color.artwork.fallbackEnd": "#cdd1dc",
    "color.lyrics.active": "#202124",
    "color.lyrics.past": "#4f5359",
    "color.lyrics.upcoming": "#34373c",
    "color.lyrics.translation": "#5f6368",
    "shape.radius.control": 6,
    "shape.radius.surface": 8,
    "shape.radius.artwork": 6,
    "elevation.surface": "0 10px 30px #2424241a",
    "effects.backdropBlur": 0,
    "effects.ambientGlowStrength": 0,
    "component.lyrics.activeScale": 1.02,
    "component.lyrics.inactiveOpacity": 0.82,
    "density.scale": 0.94,
    "motion.duration.fast": 100,
    "motion.duration.normal": 160
  },
  "behavior": {
    "accent_source": "fixed",
    "contrast_policy": "correct-critical"
  }
}
